
<xs:schema xmlns:xs="http://www.w3.org/2001/XMLSchema">
  <xs:element name="biblioteca">
    <xs:complexType>
      <xs:sequence>
        <xs:element name="libro" maxOccurs="unbounded">
          <xs:complexType>
            <xs:sequence>
              <xs:element name="titulo">
                <xs:simpleType>
                  <xs:restriction base="xs:string">
                    <xs:maxLength value="100"/>
                  </xs:restriction>
                </xs:simpleType>
              </xs:element>
              <xs:element name="autor">
                <xs:simpleType>
                  <xs:restriction base="xs:string">
                    <xs:pattern value="[A-Z].*"/>
                  </xs:restriction>
                </xs:simpleType>
              </xs:element>
              <xs:element name="anioPublicacion">
                <xs:simpleType>
                  <xs:restriction base="xs:integer">
                    <xs:minInclusive value="1900"/>
                    <xs:maxInclusive value="2025"/>
                  </xs:restriction>
                </xs:simpleType>
              </xs:element>
              <xs:element name="genero">
                <xs:simpleType>
                  <xs:restriction base="xs:string">
                    <xs:enumeration value="Novela"/>
                    <xs:enumeration value="PoesÃ­a"/>
                    <xs:enumeration value="Ensayo"/>
                    <xs:enumeration value="Teatro"/>
                  </xs:restriction>
                </xs:simpleType>
              </xs:element>
              <xs:element name="isbn">
                <xs:simpleType>
                  <xs:restriction base="xs:string">
                    <xs:pattern value="\d{3}-\d{2}-\d{4}-\d{3}-\d"/>
                  </xs:restriction>
                </xs:simpleType>
              </xs:element>
            </xs:sequence>
            <xs:attribute name="id" type="xs:positiveInteger" use="required"/>
          </xs:complexType>
        </xs:element>
      </xs:sequence>
    </xs:complexType>
  </xs:element>
</xs:schema>
