<?xml version="1.0" encoding="UTF-8"?>
<biblioteca xmlns:xsi="http://www.w3.org/2001/XMLSchema-instance" xsi:noNamespaceSchemaLocation="relacion4-1.xsd">
    <libro id="1">
        <titulo>Cien Años de Soledad</titulo>
        <autor>Gabriel Garcia Marquez</autor>
        <anioPublicacion>1967</anioPublicacion>
        <genero>Novela</genero>
        <isbn>978-84-3764-049-7</isbn>
    </libro>
    <libro id="2">
        <titulo>La Odisea</titulo>
        <autor>Homero</autor>
        <anioPublicacion>1995</anioPublicacion>
        <genero>Poesía</genero>
        <isbn>978-84-2494-049-2</isbn>
    </libro>
</biblioteca>